,Name,Title,Description,Price,Stock,SEO Title,SEO Description,SEO Keywords,
,handbag_black,Дамская сумка черная.,"В наличии черный марокканский кошелек из натуральной кожи, с тиснением, напоминающим витиеватые ветви. Легкие отблески придают глубину текстуре, подчеркивая качество ручной работы. Металлическая застежка бронзового оттенка с характерными царапинами добавляет нотку ретро, а белая строчка завершает строгий образ. Рука, аккуратно обхватывающая кошелек, создает ощущение утонченности, подчеркивая стиль и элегантность. Эта работа станет акцентом в интерьере, привнося атмосферу спокойствия и стиля.",4500,1,Элегантный черный кожаный кошелек с тиснением из Феса,Изучите изысканный черный кошелек с антикварным тиснением и бронзовой застежкой. Идеален для повседневного использования.,"кошелек, черный, кожа, тиснение, антикварный, элегантный, Фес, аксессуар, женская рука, стиль",
,handbag_BW,Дамская сумка черная с белыми швами.,"Эта дамская сумочка-кошелек из натуральной кожи, созданная вручную в марокканском Фесе, воплощает утонченность и исключительность. Чёрный кожаный клатч с изысканным тиснением цветочных и геометрических узоров привлекает внимание своей текстурой и глубиной. Металлическая застёжка с антикварной отделкой и контрастная белая строчка подчеркивают мастерство исполнения. Сумочка станет элегантным аксессуаром в вашем гардеробе. Каждая деталь — это отражение авторской идеи, придающей изделию особую ценность.",3500,1,Элегантный черный кожаный кошелек ручной работы из Феса,"Уникальный кошелек из натуральной кожи с тиснением, выполненный вручную. Откройте для себя стиль и качество этого изысканного аксессуара.","кошелек, клатч, натуральная кожа, ручная работа, Фес, тиснение, элегантность, аксессуар, стиль",
,ladysbag_black,Сумка женская кроссбоди из натуральной кожи в стиле бохо черная. Дубовый лист.,"Кожаная дамская сумочка из Марокко с восточным тиснением захватывает своей уникальностью и выразительным дизайном. Коричневая кожа с естественными морщинками и рельефом придаёт изделию характер, а симметричная крышка, напоминающая ракушку, добавляет изысканности. Компактные размеры делают её идеальной для повседневного использования, а ручная работа мастера подчеркивает ценность оригинала.
Этот аксессуар станет стильным оригинальным аксессуаром в вашем гардеробе.",7500,1,Кожаная мини-сумка с восточным тиснением для стильного образа,"Уникальная кожаная сумка с декоративной крышкой и ручной отделкой. Откройте для себя стильный аксессуар, который подчеркнет вашу индивидуальность.","кожаная сумка, мини-сумка, восточное тиснение, аксессуар, ручная работа, стильный дизайн, уникальность, экологичность, натуральные материалы",
,ladysbag_brownlaser,Сумка женская кроссбоди из натуральной кожи в стиле бохо коричневая с вырезами.,"В наличии марокканская кроссбоди сумка, в которой гармонично сочетаются рустикальный стиль и утончённость. Тёплый коричневый цвет кожи с характерными прожилками придаёт изделию живость, а ручное тиснение в виде цветочных узоров добавляет индивидуальности. Компактный размер делает её практичной для повседневных нужд, а винтажный замочек акцентирует внимание на качестве исполнения. Нейтральный светло-бежевый фон подчеркивает красоту сумки, создавая атмосферу уюта и уверенности. Этот аксессуар сам по себе является выразительным свидетельством мастерства ручной работы.",7500,1,женская кожаная мини-сумка с ручным тиснением,Эта мини-сумка из натуральной кожи с уникальным тиснением станет вашим идеальным аксессуаром для стильных прогулок.,"кожаная сумка, мини-сумка, ручная работа, тиснение, винтажный стиль, аксессуар, уют, стиль",
,ladysbag_yellow,Сумка женская кроссбоди из натуральной кожи в стиле бохо жёлтая.,"В наличии яркая желтая кожаная сумка из Марокко. Ее необычная форма, напоминающая голову совы, вместе с замысловатыми узорами и аккуратной ручной работой, придает изделию характер и индивидуальность. Сумка становится аксессуаром, способным добавить яркие эмоции и уют в любое пространство. Светло-коричневая лямка создает контраст, подчеркивая натуральность материалов. Это уникальное произведение искусства, способное привнести гармонию с природой и ощущение спокойствия в повседневную жизнь. Натуральная кожа, ручная работа, изготовлено в городе Фес, Марокко, Северная Африка. В наличии в России.",7500,1,Яркая желтая кожаная сумка с узорчатой вышивкой для прогулок,Уникальная кожаная сумка жёлтого цвета с интересной формой и узорами. Идеальный аксессуар для летних прогулок на свежем воздухе.,"кожаная сумка, желтая сумка, аксессуар, ручная работа, узоры, летние прогулки, стиль, природа, уют","Натуральная кожа, ручная работа, изготовлено в городе Фес, Марокко, Северная Африка. В наличии в России."
,makeup_brown,Косметичка с двумя отсеками и ручкой.,"Эта марокканская косметичка из гладкой коричневой кожи, результат тонких взаимодействии традиционного мастерства и современного дизайна. Каждая складка и неровность материала придают ей уникальность, а белая декоративная строчка создает выразительный контраст, подчеркивая элегантность. Яркие металлические замки добавляют современный акцент, а натуральные оттенки кожи гармонируют с окружающим миром. Этот аксессуар превращает повседневность в стильный ритуал, наполняя пространство теплом и уютом.",4950,1,Кожаная косметичка ручной работы из Марокко,Откройте для себя уникальную косметичку из гладкой коричневой кожи с декоративной строчкой и металлическими замками. Идеальный аксессуар для стильного образа.,"косметичка, кожаная сумка, ручная работа, Марокко, стильный аксессуар, коричневая кожа, декоративная строчка, металлические замки",
,makeup_zamsh,Косметичка замшевая.,"Эта косметичка из мягкой замши серо-коричневого оттенка — это не просто аксессуар, а отражение марокканской культуры и мастерства. Ручная работа придаёт ей уникальность, а лаконичный дизайн без лишних деталей подчёркивает элегантность. Высокая детализация позволяет ощутить текстуру, а блеск металлической молнии добавляет завершённости. Такой аксессуар станет изюминкой в вашем гардеробе, наполняя пространство атмосферой комфорта и стиля.",2950,1,Косметичка из замши: уникальный аксессуар из Марокко,"Откройте для себя косметичку из натуральной замши, отражающую культуру Марокко. Уникальный дизайн и высокое качество изготовления.","косметичка, замша, Марокко, аксессуар, ручное производство, уникальный дизайн, стиль, уют",
,pencilcase_black,Пенал чёрный классический. ,"В наличии элегантная кожаная косметичка из Марокко. Насыщенный черный цвет подчеркивает изящество изделия, а белая строчка и серебристые детали молнии добавляют современный акцент. Жаркая атмосфера города Фес в Северной Африке, в которой она создавалась, придает ощущение умиротворения и стиля. Эта косметичка станет не только практичным аксессуаром, но и выразительным элементом вашего гардероба, наполняя пространство индивидуальностью и изысканностью.",2450,1,Черная кожаная косметичка из Марокко – стиль и индивидуальность,"Откройте для себя уникальную черную косметичку из Марокко, выполненную вручную. Идеальный аксессуар для любого случая.","косметичка, черная кожа, ручная работа, стильный пенал, аксессуар, марокканский дизайн, барсетка, качественные детали",
,pencilcase_brown,Пенал коричневый.,"Кожаный пенал из Марокко воплощает гармонию практичности и изысканности. Его светло-коричневая текстура, подчеркнутая естественными складками, создает ощущение тепла и уюта. Серебристая молния, аккуратно вшитая, акцентирует внимание на высоком качестве ручной работы. С мягкими округлыми контурами пенал излучает элегантность и комфорт. Страна африканского города Фес, в котором создали этот пенал и энергией которого наполнена эта косметичка, усиливает атмосферу теплоты и спокойствия, придавая изделию особую ценность для повседневного использования.",2450,1,Кожаный пенал ручной работы из Марокко - уникальный аксессуар,"Откройте для себя элегантный кожаный пенал из натуральной кожи. Идеальный аксессуар для мужчин и женщин, подчеркивающий качество и стиль.","кожаный пенал, ручная работа, натуральная кожа, аксессуар, Марокко, стиль, качество, мужской кошелек, женский пенал",
,pencilcase_cherry,Пенал вишневый. ,"В наличии коричневый кожаный пенал из Северной Африки, который словно впитает в себя атмосферу марокканского ремесла. Его текстура — неровная, с естественными складками — рассказывает о ручной работе и уникальности каждого изделия. Прямоугольная форма и металлическая молния добавляют современный штрих, а светлая нить прошивки контрастирует с тёплым оттенком кожи. Пенал, сделанный в ручную из натуральной кожи в жарком Марокко, создает ощущение гармонии с природой. Этот аксессуар станет не только функциональным элементом, но и стильным элементом вашего гардероба, наполняя пространство уютом и аутентичностью.",2450,1,Кожаный пенал ручной работы из Марокко - стиль и уют,Откройте для себя коричневый кожаный пенал с текстурой и молнией. Идеальное сочетание стиля и практичности для вашего образа.,"кошелек, пенал, кожа, ручная работа, Марокко, стиль, аксессуары, уют",
,pencilcase_nut,Пенал ореховый. ,"В наличии кожаный пенал из марокканской кожи. Его насыщенный рыжевато-коричневый оттенок и тонкий узор натуральной текстуры создают атмосферу уюта и тепла. Аккуратная светло-бежевых молния и белые строчки подчеркивают мастерство ручного производства, добавляя оригинальности. Этот аксессуар станет стильным элементом в вашем гардеробе, подчеркивая вашу индивидуальность и ваш вкус.",2450,1,Кожаный пенал из Марокко: стиль и качество в одном,"Откройте для себя уникальный кожаный пенал из Марокко. Стильный и практичный аксессуар для хранения мелочей, выполненный вручную.","кожаный пенал, Марокко, аксессуар, ручное производство, стиль, качество, хранение, натуральная кожа, барсетка, мужской кошелек",
,purse_brown,Женский кошелек коричневый. Колёса Сансары.,"В наличии темно-коричневый кошелек из солнечного Марокко, выполненный из качественной кожи. Он привлекает внимание своей изысканной текстурой и уникальными резными узорами. Симметрия геометрических и цветочных орнаментов создает ощущение гармонии, а аккуратная белая строчка подчеркивает мастерство ручной работы. Визуально он выглядит как стильный клатч, а его теплый шоколадный оттенок добавляет уют в любой интерьер. Кнопка из черного металла акцентирует внимание на деталях, создавая образ надежности и утонченности. Этот кошелек станет не только практичным аксессуаром, но и выразительным элементом вашего гардероба.",3500,1,Кожаный кошелек из Марокко: стиль и качество ручной работы,Откройте для себя уникальный коричневый кошелек с резными узорами. Идеальный аксессуар для стильных образов.,"кошелек, Марокко, ручная работа, коричневый, кожаный, аксессуар, стиль, узоры, качество",
,wallet_black,Кошелек карманный. Чёрный.,"В наличии черный кожаный кошелек из древнего города Фес, Марокко, что в Северной Африке. Кошелек из натуральной кожи, выполненный вручную,  словно заключает в себе тайны мастерства и изысканности. Его поверхность украшена тонким орнаментом, отсылающим к стилю барокко, в каждой линии ощущается внимание к деталям. Клапан с округлыми углами, дополняемый аккуратной строчкой, подчеркивает элегантность изделия.  Этот кошелек очень функционален.",1950,1,Кожаные кошельки из Марокко: уникальный дизайн и ручная работа,,"кожаные кошельки, Марокко, ручная работа, узоры, барокко, арт-нуво, стиль, элегантность, аксессуары",
,wallet_blue,Кошелек карманный. Голубой.,"В налчии изысканная ручная работа — кожаный кошелек-конверт яркого бирюзово-голубого оттенка.  Страна изготовления дренвие мастера в старом городе Фес, что находится в Марокко на самом севере Африки. Его текстура с тонким тиснением, напоминающим цветочные узоры, придаёт изделию неповторимый характер и элегантность. Треугольный клапан, украшенный аккуратной строчкой и стильной кнопкой, создает гармоничное сочетание формы и функциональности. Компактный дизайн позволяет удобно хранить карты и деньги, а размытие фона подчеркивает его красоту. Этот аксессуар станет ярким предметом вашего гардероба, добавляя нотки уюта и эстетического наслаждения.",1950,1,Кожаный кошелек из Марокко с уникальным тиснением,Откройте для себя элегантный кожаный кошелек из Марокко. Уникальный дизайн и высокое качество исполнения привлекают внимание.,"кожаный кошелек, Марокко, тиснение, элегантный дизайн, аксессуары, бирюзовый, компактный, ручная работа",
,wallet_magnetbrwn,Кошелек карманный с магнитной кнопкой. Коричневый.,"В наличии кожаный кошелек из Марокко, представленный на фотографии, который излучает изысканность и тепло Северной Африки. Его шоколадно-коричневая кожа с зернистой текстурой и искусно выполненные тиснения создают уникальный визуальный язык, который сразу притягивает взгляд. Золотистая застежка-кнопка, отражающая свет, добавляет винтажного шарма, а контрастные швы подчеркивают мастерство ручной работы. Уютное и спокойное настроение изображения, подчеркнутое мягкой романтичностью фона, делает этот кошелек идеальным акцентом в интерьере. Он станет не просто красивым аксессуаром, а настоящим символом стиля и истории, способным добавить глубину и характер вашему гардеробу.",3250,1,Уникальный кожаный кошелек из Марокко ручной работы,Откройте для себя стильный кожаный кошелек из Марокко с изящным тиснением. Позвольте ему стать акцентом вашего образа.,"кожаный кошелек, Марокко, ручная работа, тиснение, стильный аксессуар, натуральная кожа, шоколадный цвет, винтажный стиль",
,wallet_yellow,Кошелек карманный. Жёлтый.,"В наличии уникальное произведение марокканского ремесла — кожаный кошелёк-клатч, выполненный вручную из медово-жёлтой кожи. Его изысканный тиснёный орнамент, напоминающий переплетение листьев, придаёт изделию утончённость и гармонию. Контрастная чёрная кнопка акцентирует внимание на центре, а мягкое освещение подчеркивает рельеф и текстуру, создавая ощущение тепла и заботы. Этот кошелёк не просто аксессуар, а настоящая находка, способная оживить гардероб и стать акцентом вашего стиля.",1950,1,Кожаный кошелек-клатч из Марокко: стиль и ручная работа,Изучите уникальный кожаный кошелек-клатч с тиснением. Идеальное сочетание стиля и функциональности для хранения карт и денег.,"кожаный кошелек, клатч, ручная работа, тиснение, Марокко, стиль, аксессуары, желтая кожа, орнамент",